{
  "schema_version": "1.0",
  "request_id": "REQ-cdc98b1d-b1b7-47b4-9e92-97987f709a62",
  "created_at": "2026-01-16T11:59:45.431607Z",
  "input": {
    "source_channel": "manual_upload",
    "file": {
      "filename": "5.pdf",
      "pages": 2
    },
    "metadata": {}
  },
  "extraction": {
    "text_source": "native",
    "language": "ru",
    "page_map": [
      {
        "page": 1,
        "text_span_id": "p1",
        "char_start": 0,
        "char_end": 1649
      },
      {
        "page": 2,
        "text_span_id": "p2",
        "char_start": 1651,
        "char_end": 2573
      }
    ],
    "quality": {
      "ocr_confidence": 0.95,
      "has_tables": false,
      "has_stamps_signatures": "unknown",
      "warnings": []
    }
  },
  "understanding": {
    "doc_type": "unknown",
    "summary": "Заявка на получение дотации местным бюджетам на поддержку мер по обеспечению сбалансированности местных бюджетов из областного бюджета на 2026 год В соответствии с Законом Липецкой области от 12.12.20",
    "topics": [],
    "urgency": {
      "level": "normal",
      "signals": []
    },
    "entities": {
      "organizations": [
        {
          "name": "Заявка на получение дотации местным бюджетам на поддержку мер по обеспечению сбалансированности местных бюджетов из областного бюджета на 2026 год В соответствии с Законом Липецкой области от 12.12.2025 N 722-ОЗ \"Об областном бюджете на 2026 год и на плановый период 2027 и 2028 годы\" и постановлением Правительства Липецкой области от 17.08.2022 N 97 \"Об утверждении методики распределения и правил предоставления дотаций местным бюджетам на поддержку мер по обеспечению сбалансированности местных бюджетов из областного бюджета\" администрация Лев-Толстовского муниципального района просит предоставить дотацию местным бюджетам на поддержку мер по обеспечению сбалансированности местных бюджетов из областного бюджета в сумме 16 000 000 (шестнадцать миллионов) руб. для проведения работ по реконструкции сетей теплоснабжения на территории парка по ул. Володарского в п. Лев Толстой. Проведение данных работ необходимо в связи с реализацией в 2026 году сельским поселением Лев-Толстовский сельсовет регионального проекта «Создание комфортной городской среды в малых городах и исторических поселениях - победителях Всероссийского конкурса лучших проектов создания комфортной городской среды» благоустройства на объекте: «Парк Толстого. «Зеленая палочка счастья». Реконструкция сетей теплоснабжения позволит улучшить внешний облик и АДМИНИСТРАЦИЯ Лев-Толстовского муниципального района Липецкой области Российской Федерации ул.Володарского, д.29, пос.Лев Толстой, Липецкая область, 399870",
          "role": "sender"
        }
      ],
      "people": [],
      "numbers": {
        "contract_numbers": [],
        "invoice_numbers": [],
        "letter_numbers": [],
        "law_refs": []
      },
      "dates": [],
      "amounts": [],
      "locations": []
    }
  },
  "routing": {
    "mode": "auto_route_allowed",
    "suggestions": [
      {
        "department_id": "FIN_BUDG_INTERBUDG",
        "department_name": "Отдел бюджетного планирования и межбюджетных отношений",
        "confidence": 1.0,
        "priority": "primary",
        "why": "Совпали ключевые слова; сработали правила триажа",
        "matched_signals": {
          "keywords": [
            "проект местного бюджета",
            "плановый период",
            "расходные обязательства"
          ],
          "rules_triggered": [
            "Маршрутизировать в этот отдел с высоким приоритетом.",
            "Маршрутизировать в этот отдел; если письмо про фактическое перечисление/платежи — добавить Казначейство/исполнение бюджета (если есть отдельный отдел)."
          ],
          "semantic_score": 0.0
        },
        "evidence": [],
        "next_actions": []
      }
    ],
    "final_recommendation": {
      "department_ids": [
        "FIN_BUDG_INTERBUDG"
      ],
      "confidence": 1.0,
      "comment": "Heuristic selection based on keyword scores."
    },
    "needs_human_review": false,
    "review_reasons": []
  },
  "compliance": {
    "sensitive_flags": [],
    "safe_to_log_text": "yes",
    "masking": {
      "enabled": false,
      "masked_fields": []
    }
  },
  "diagnostics": {
    "processing_time_ms": 50,
    "model": {
      "name": "heuristic-router",
      "version": "dev"
    },
    "trace": {
      "rules_version": "dev",
      "catalog_version": "dev"
    },
    "errors": [],
    "warnings": []
  }
}