{
  "schema_version": "1.0",
  "request_id": "REQ-2026-0001",
  "created_at": "2026-01-15T13:43:34.075385Z",
  "input": {
    "document_id": "DOC-12345",
    "source_channel": "email",
    "file": {
      "filename": "incoming_letter.pdf",
      "sha256": "aaaaaaaaaaaaaaaaaaaaaaaaaaaaaaaaaaaaaaaaaaaaaaaaaaaaaaaaaaaaaaaa",
      "pages": 3
    },
    "metadata": {
      "email_subject": "О проведении защит проектов",
      "sender": "office@example.org",
      "received_at": "2026-01-15T13:43:34.075397Z"
    }
  },
  "extraction": {
    "text_source": "native",
    "language": "ru",
    "page_map": [
      {
        "page": 1,
        "text_span_id": "p1",
        "char_start": 0,
        "char_end": 1200
      }
    ],
    "quality": {
      "ocr_confidence": 0.98,
      "has_tables": false,
      "has_stamps_signatures": "unknown",
      "warnings": []
    }
  },
  "understanding": {
    "doc_type": "служебное письмо",
    "summary": "Письмо о проведении защит проектов в рамках дорожной карты по ИИ‑трансформации.",
    "topics": [
      "ИИ",
      "проекты",
      "защиты"
    ],
    "urgency": {
      "level": "normal",
      "signals": []
    },
    "entities": {
      "organizations": [
        {
          "name": "Министерство цифрового развития",
          "role": "mentioned"
        }
      ],
      "people": [],
      "numbers": {
        "contract_numbers": [],
        "invoice_numbers": [],
        "letter_numbers": [
          "01-12/345"
        ],
        "law_refs": []
      },
      "dates": [
        {
          "value": "2026-02-15",
          "label": "дата защит"
        }
      ],
      "amounts": [],
      "locations": []
    }
  },
  "routing": {
    "mode": "auto_route_allowed",
    "suggestions": [
      {
        "department_id": "DIGITAL_AI_OFFICE",
        "department_name": "Проектный офис ИИ и цифровой трансформации",
        "confidence": 0.82,
        "priority": "primary",
        "why": "Тематика письма связана с ИИ‑проектами и проведением защит.",
        "matched_signals": {
          "keywords": [
            "ИИ",
            "дорожная карта",
            "проекты",
            "защиты"
          ],
          "rules_triggered": [
            "ai_projects_rule"
          ],
          "semantic_score": 0.79
        },
        "evidence": [
          {
            "page": 1,
            "quote": "в рамках реализации дорожной карты по ИИ‑трансформации",
            "char_start": 150,
            "char_end": 210
          }
        ],
        "next_actions": [
          "Назначить ответственного",
          "Подготовить график защит"
        ],
        "handoff": {
          "queue": "AI_PROJECTS_INBOX",
          "assignee_role": "project_manager",
          "sla_hours": 24
        }
      }
    ],
    "final_recommendation": {
      "department_ids": [
        "DIGITAL_AI_OFFICE"
      ],
      "confidence": 0.82,
      "comment": "Основная компетенция — сопровождение ИИ‑проектов."
    },
    "needs_human_review": false,
    "review_reasons": []
  },
  "compliance": {
    "sensitive_flags": [],
    "safe_to_log_text": "yes",
    "masking": {
      "enabled": false,
      "masked_fields": []
    }
  },
  "diagnostics": {
    "processing_time_ms": 1840,
    "model": {
      "name": "gpt-4.1",
      "version": "2026-01"
    },
    "trace": {
      "rules_version": "1.0",
      "catalog_version": "2026-01"
    },
    "errors": [],
    "warnings": []
  }
}