{
  "schema_version": "1.0",
  "request_id": "REQ-9587bd0d-83ce-439e-b4b3-8bff15c2db30",
  "created_at": "2026-01-16T10:46:30.744603Z",
  "input": {
    "source_channel": "manual_upload",
    "file": {
      "filename": "4.pdf",
      "pages": 1
    },
    "metadata": {}
  },
  "extraction": {
    "text_source": "native",
    "language": "ru",
    "page_map": [
      {
        "page": 1,
        "text_span_id": "p1",
        "char_start": 0,
        "char_end": 681
      }
    ],
    "quality": {
      "ocr_confidence": 0.95,
      "has_tables": false,
      "has_stamps_signatures": "unknown",
      "warnings": []
    }
  },
  "understanding": {
    "doc_type": "unknown",
    "summary": "МИНИСТЕРСТВО ВНУТРЕННЕЙ ПОЛИТИКИ ЛИПЕЦКОЙ ОБЛАСТИ 398050, г. Липецк, ул. Зегеля, д.2 тел./факс 8(4742)27-71-86 e-mail:svz@admlr.lipetsk.ru И.о. министра финансов Липецкой области С.Н. Володиной Уважае",
    "topics": [
      "reporting"
    ],
    "urgency": {
      "level": "normal",
      "signals": []
    },
    "entities": {
      "organizations": [],
      "people": [],
      "numbers": {
        "contract_numbers": [],
        "invoice_numbers": [],
        "letter_numbers": [],
        "law_refs": []
      },
      "dates": [],
      "amounts": [],
      "locations": []
    }
  },
  "routing": {
    "mode": "auto_route_allowed",
    "suggestions": [
      {
        "department_id": "FIN_BUDG_INTERBUDG",
        "department_name": "Отдел бюджетного планирования и межбюджетных отношений",
        "confidence": 0.0,
        "priority": "primary",
        "why": "Ключевых совпадений нет",
        "matched_signals": {
          "keywords": [],
          "rules_triggered": [],
          "semantic_score": 0.0
        },
        "evidence": [],
        "next_actions": []
      }
    ],
    "final_recommendation": {
      "department_ids": [
        "FIN_BUDG_INTERBUDG"
      ],
      "confidence": 0.0,
      "comment": "Heuristic selection based on keyword scores. Low score; needs human review."
    },
    "needs_human_review": true,
    "review_reasons": []
  },
  "compliance": {
    "sensitive_flags": [],
    "safe_to_log_text": "yes",
    "masking": {
      "enabled": false,
      "masked_fields": []
    }
  },
  "diagnostics": {
    "processing_time_ms": 24,
    "model": {
      "name": "heuristic-router",
      "version": "dev"
    },
    "trace": {
      "rules_version": "dev",
      "catalog_version": "dev"
    },
    "errors": [],
    "warnings": []
  }
}